Sheet: Efectos marginales p11
B1: P(Y1=1,Y2=1)
A2: VARIABLES | B2: Efectos marginales de la probabilidad de solicitar cr√©dito formal e informal | C2: [ Intervalo de confianza 95% ]
A4: Tiempo oficina | B4: -7.43e-05** | C4: -1.3999999999999999E-4 | D4: -6.0000000000000002E-6
B5: (3.45e-05)
A6: Estado civil | B6: 0.00558** | C6: 5.752E-4 | D6: 1.0594599999999999E-2
B7: (0.00256)
A8: Edad | B8: 0.00171** | C8: 3.9839999999999998E-4 | D8: 3.0138000000000001E-3
B9: (0.000667)
A10: Edad^2 | B10: -1.99e-05*** | C10: -3.4900000000000001E-5 | D10: -4.6E-6
B11: (7.63e-06)
A12: Educaci√≥n(2) | B12: 0.00177 | C12: -5.5087000000000001E-3 | D12: 9.0390999999999996E-3
B13: (0.00371)
A14: Educaci√≥n(3) | B14: 0.00118 | C14: -6.5288000000000004E-3 | D14: 8.8883999999999994E-3
B15: (0.00393)
A16: Mujer | B16: -0.00184 | C16: -6.1952999999999999E-3 | D16: 2.5170000000000001E-3
B17: (0.00222)
A18: Empleo dependiente | B18: -0.0115*** | C18: -1.9020499999999999E-2 | D18: -3.9363000000000002E-3
B19: (0.00385)
A20: Ingresos(1) | B20: 0.00542 | C20: -1.1359E-3 | D20: 1.1971900000000001E-2
B21: (0.00334)
A22: Ingresos(2) | B22: 0.0111*** | C22: 3.5325999999999999E-3 | D22: 1.8602E-2
B23: (0.00384)
A24: Ingresos(3) | B24: 0.0108** | C24: 2.3308999999999999E-3 | D24: 1.9210000000000001E-2
B25: (0.00431)
A26: Ingresos(4) | B26: 0.00520* | C26: -4.3839999999999998E-4 | D26: 1.08428E-2
B27: (0.00288)
A28: Usa activos | B28: 0.00541** | C28: 7.1630000000000001E-4 | D28: 1.01057E-2
B29: (0.00240)
A30: Productos financieros | B30: 0.00805** | C30: 8.6580000000000001E-4 | D30: 1.5227900000000001E-2
B31: (0.00366)
A32: Ahorro | B32: 0.0129** | C32: 2.5336E-3 | D32: 2.3263499999999999E-2
B33: (0.00529)
A34: Costo de impedimento | B34: 0.00572* | C34: -3.05E-6 | D34: 1.1440799999999999E-2
B35: (0.00292)
A36: Impedimento por tr√°mite | B36: 0.00206 | C36: -2.0328999999999998E-3 | D36: 6.1447000000000003E-3
B37: (0.00209)
A38: Cr√©dito consumo | B38: 0.0492*** | C38: 2.5478199999999999E-2 | D38: 7.2898299999999999E-2
B39: (0.0121)
A40: Cr√©dito colateral | B40: 0.0428*** | C40: 2.2045599999999999E-2 | D40: 6.3482399999999994E-2
B41: (0.0106)
A42: Calculo intereses | B42: 0.00316 | C42: -1.6362E-3 | D42: 7.9597999999999995E-3
B43: (0.00245)
A44: Grandes cuidadeas | B44: 0.00547** | C44: 3.9130000000000002E-4 | D44: 1.0541E-2
B45: (0.00259)
A46: Resto urbano | B46: -4.26e-05 | C46: -3.6895000000000001E-3 | D46: 3.6042000000000001E-3
B47: (0.00186)
A48: Rural | B48: 0.00681 | C48: -2.4938E-3 | D48: 1.6114099999999999E-2
B49: (0.00475)
A51: Observaciones | B51: 3,899
A52: errores est√°ndar robustos en par√©ntesis
A53: *** p<0.01, ** p<0.05, * p<0.1

Sheet: Efectos marginales p10
B1: P(Y1=1,Y2=0)
A2: VARIABLES | B2: Efectos marginales de la probabilidad de solicitar cr√©dito formal pero no informal | C2: [ Intervalo de confianza 95% ]
A4: Tiempo oficina | B4: -0.00104*** | C4: -1.7962E-3 | D4: -2.856E-4
B5: (0.000385)
A6: Estado civil | B6: 0.0339 | C6: -1.14892E-2 | D6: 7.9220899999999997E-2
B7: (0.0231)
A8: Edad | B8: 0.0161*** | C8: 7.8060999999999998E-3 | D8: 2.4451000000000001E-2
B9: (0.00425)
A10: Edad^2 | B10: -0.000161*** | C10: -2.5730000000000002E-4 | D10: -6.5099999999999997E-5
B11: (4.90e-05)
A12: Educaci√≥n(2) | B12: 0.0336 | C12: -1.82813E-2 | D12: 8.5402000000000006E-2
B13: (0.0265)
A14: Educaci√≥n(3) | B14: 0.0503 | C14: -1.46491E-2 | D14: 0.1151964
B15: (0.0331)
A16: Mujer | B16: 0.0164 | C16: -2.2964100000000001E-2 | D16: 5.5679800000000002E-2
B17: (0.0201)
A18: Empleo dependiente | B18: -0.0644*** | C18: -0.1079024 | D18: -2.0990600000000002E-2
B19: (0.0222)
A20: Ingresos(1) | B20: 0.0690*** | C20: 2.0542999999999999E-2 | D20: 0.1174424
B21: (0.0247)
A22: Ingresos(2) | B22: 0.0732*** | C22: 2.3016600000000002E-2 | D22: 0.1233529
B23: (0.0256)
A24: Ingresos(3) | B24: 0.0734*** | C24: 2.15943E-2 | D24: 0.12511079999999999
B25: (0.0264)
A26: Ingresos(4) | B26: 0.158*** | C26: 7.4907399999999999E-2 | D26: 0.2409008
B27: (0.0423)
A28: Usa activos | B28: 0.0609*** | C28: 2.3320799999999999E-2 | D28: 9.8493499999999998E-2
B29: (0.0192)
A30: Productos financieros | B30: 0.133*** | C30: 9.1337100000000004E-2 | D30: 0.17449190000000001
B31: (0.0212)
A32: Ahorro | B32: 0.0607** | C32: 1.01993E-2 | D32: 0.1112158
B33: (0.0258)
A34: Costo de impedimento | B34: 0.0523** | C34: 1.17219E-2 | D34: 9.2810799999999999E-2
B35: (0.0207)
A36: Impedimento por tr√°mite | B36: 0.0365 | C36: -9.8223000000000008E-3 | D36: 8.2729899999999995E-2
B37: (0.0236)
A38: Cr√©dito consumo | B38: 0.120*** | C38: 6.6671999999999995E-2 | D38: 0.17421130000000001
B39: (0.0274)
A40: Cr√©dito colateral | B40: 0.349*** | C40: 0.26085910000000001 | D40: 0.43782110000000002
B41: (0.0451)
A42: Calculo intereses | B42: 0.0472** | C42: 1.1163E-3 | D42: 9.3227000000000004E-2
B43: (0.0235)
A44: Grandes cuidadeas | B44: 0.0780*** | C44: 3.1808799999999998E-2 | D44: 0.12428110000000001
B45: (0.0236)
A46: Resto urbano | B46: 0.0898*** | C46: 3.6400500000000002E-2 | D46: 0.1431151
B47: (0.0272)
A48: Rural | B48: 0.107*** | C48: 4.0164600000000002E-2 | D48: 0.17380609999999999
B49: (0.0341)
A51: Observations | B51: 3,899
A52: errores est√°ndar robustos en par√©ntesis
A53: *** p<0.01, ** p<0.05, * p<0.1

Sheet: Efectos marginales p01
B1: P(Y1=0,Y2=1)
A2: VARIABLES | B2: Efectos marginales de la probabilidad de no solicitar cr√©dito formal pero si informal | C2: [ Intervalo de confianza 95% ]
A4: Tiempo oficina | B4: 0.000177*** | C4: 5.8199999999999998E-5 | D4: 2.966E-4
B5: (6.08e-05)
A6: Estado civil | B6: 0.0409 | C6: -1.13863E-2 | D6: 9.3220200000000003E-2
B7: (0.0267)
A8: Edad | B8: 0.00543 | C8: -4.5818999999999999E-3 | D8: 1.5432400000000001E-2
B9: (0.00511)
A10: Edad^2 | B10: -9.67e-05 | C10: -2.139E-4 | D10: 2.0599999999999999E-5
B11: (5.98e-05)
A12: Educaci√≥n(2) | B12: -0.0172 | C12: -0.10198110000000001 | D12: 6.7588800000000004E-2
B13: (0.0433)
A14: Educaci√≥n(3) | B14: -0.0441 | C14: -0.1349129 | D14: 4.67061E-2
B15: (0.0463)
A16: Mujer | B16: -0.0471* | C16: -9.6476000000000006E-2 | D16: 2.2236000000000001E-3
B17: (0.0252)
A18: Empleo dependiente | B18: -0.0904*** | C18: -0.150091 | D18: -3.07132E-2
B19: (0.0305)
A20: Ingresos(1) | B20: 0.0406 | C20: -2.3780699999999998E-2 | D20: 0.1048893
B21: (0.0328)
A22: Ingresos(2) | B22: 0.100*** | C22: 2.9241699999999999E-2 | D22: 0.17139950000000001
B23: (0.0363)
A24: Ingresos(3) | B24: 0.0973*** | C24: 3.4509900000000003E-2 | D24: 0.1600538
B25: (0.0320)
A26: Ingresos(4) | B26: -0.0389 | C26: -0.1166908 | D26: 3.88557E-2
B27: (0.0397)
A28: Usa activos | B28: 0.00527 | C28: -4.5782700000000003E-2 | D28: 5.6332E-2
B29: (0.0261)
A30: Productos financieros | B30: -0.0439 | C30: -0.1148151 | D30: 2.69234E-2
B31: (0.0362)
A32: Ahorro | B32: 0.116*** | C32: 4.1815100000000001E-2 | D32: 0.19001199999999999
B33: (0.0378)
A34: Costo de impedimento | B34: 0.0204 | C34: -3.2618800000000003E-2 | D34: 7.3386000000000007E-2
B35: (0.0270)
A36: Impedimento por tr√°mite | B36: -0.0143 | C36: -6.8548399999999995E-2 | D36: 3.9987599999999998E-2
B37: (0.0277)
A38: Cr√©dito consumo | B38: 0.578*** | C38: 0.51148700000000002 | D38: 0.64430350000000003
B39: (0.0339)
A40: Cr√©dito colateral | B40: 0.203*** | C40: 9.9817400000000001E-2 | D40: 0.30653540000000001
B41: (0.0527)
A42: Calculo intereses | B42: -0.0111 | C42: -7.3331099999999996E-2 | D42: 5.11596E-2
B43: (0.0318)
A44: Grandes cuidadeas | B44: -0.0232 | C44: -9.8203899999999997E-2 | D44: 5.18968E-2
B45: (0.0383)
A46: Resto urbano | B46: -0.112*** | C46: -0.1855116 | D46: -3.8281099999999998E-2
B47: (0.0376)
A48: Rural | B48: -0.0411 | C48: -0.1244996 | D48: 4.2351199999999999E-2
B49: (0.0426)
A51: Observations | B51: 3,899
A52: errores est√°ndar robustos en par√©ntesis
A53: *** p<0.01, ** p<0.05, * p<0.1

Sheet: probabilidades
B2: MODELO BIPROBIT
C4: (1) | H4: (1)
B5: VARIABLES | C5: Probabilidades estimadas | D5: [ Intervalo de confianza 95% ] | G5: VARIABLES | H5: Probabilidades estimadas | I5: [ Intervalo de confianza 95% ]
B7: P( solicita formal = 1) | C7: 0.2433*** | D7: 0.22509999999999999 | E7: 0.26150000000000001 | G7: P( solicita informal = 1) | H7: 0.3025*** | I7: 0.28239999999999998 | J7: 0.32250000000000001
C8: (0.0092) | H8: (0.0102)
B9: P( solicita formal = 1/ solicita informal = 1) | C9: 0.1267*** | D9: 0.1079 | E9: 0.1454 | G9: P( solicita informal = 1/ solicita formal = 1) | H9: 0.1755*** | I9: 0.1515 | J9: 0.19950000000000001
C10: (0.0095) | H10: (0.0122)
B11: P( solicita formal = 1 / cr√©dito consumo = 1) | C11: 0.3505*** | D11: 0.31019530000000001 | E11: 0.39098250000000001 | G11: P( solicita informal = 1 / cr√©dito consumo = 1) | H11: 0.7338*** | I11: 0.69178269999999997 | J11: 0.77587700000000004
C12: (0.0206) | H12: (0.0214)
B13: P( solicita formal = 1 / cr√©dito colateral = 1) | C13: 0.6505*** | D13: 0.56430000000000002 | E13: 0.73680000000000001 | G13: P( solicita fonrmal = 1 / cr√©dito colateral = 1) | H13: 0.4781*** | I13: 0.39600000000000002 | J13: 0.59030000000000005
C14: (0.0440) | H14: (0.0419)
B15: errores est√°ndar robustos en par√©ntesis | G15: errores est√°ndar robustos en par√©ntesis
B16: *** p<0.01, ** p<0.05, * p<0.1 | G16: *** p<0.01, ** p<0.05, * p<0.1
C19: (1)
B20: VARIABLES | C20: Probabilidades estimadas | D20: [ Intervalo de confianza 95% ]
B22: P( solicita formal = 1, solicito informal = 1) | C22: 0.0793*** | D22: 7.0007200000000006E-2 | E22: 8.8622000000000006E-2
C23: (0.0047)
B24: P( solicita formal = 1, solicita informal = 0) | C24: 0.1640*** | D24: 0.14760000000000001 | E24: 0.1804
C25: (0.0083)
B26: P( solicita formal = 0, solicia informal = 1) | C26: 0.2231*** | D26: 0.20331150000000001 | E26: 0.24307899999999999
C27: (0.0101)
B28: errores est√°ndar robustos en par√©ntesis
B29: *** p<0.01, ** p<0.05, * p<0.1
C32: (1) | H32: (1)
B33: VARIABLES | C33: Probabilidades estimadas | D33: [ Intervalo de confianza 95% ] | G33: VARIABLES | H33: Probabilidades estimadas | I33: [ Intervalo de confianza 95% ]
B35: P( solicita formal = 1, solicita informal = 0/ cr√©dito consumo=1) | C35: 0.1400*** | D35: 0.1074473 | E35: 0.17266200000000001 | G35: P( Solicita formal = 0, Solicita informal = 1/ Cr√©dito consumo=1) | H35: 0.5232*** | I35: 0.4743928 | J35: 0.5721984
C36: (0.0166) | H36: (0.0249)
B37: P( solicita formal = 1, solicita informal = 0/ cr√©dito colateral=1) | C37: 0.3539*** | D37: 0.27253300000000003 | E37: 0.43545739999999999 | G37: P( Solicita formal = 0, Solicita informal = 1/ Cr√©dito colateral=1) | H37: 0.1816*** | I37: 0.11459999999999999 | J37: 0.2485
C38: (0.0415) | H38: (0.0341)
B39: P( solicita formal = 1, solicita informal = 0/ Costo impedimento =1) | C39: 0.1836*** | D39: 0.1600047 | E39: 0.2072321 | G39: P( Solicita formal = 0, Solicita informal = 1/ Costo impedimento =1) | H39: 0.2209*** | I39: 0.1924199 | J39: 0.24945010000000001
C40: (0.0120) | H40: (0.0145)
B41: P( solicita formal = 1, solicita informal = 0/ Impedimento por tr√°mite=1) | C41: 0.1840*** | D41: 0.15145800000000001 | E41: 0.21659619999999999 | G41: P( Solicita formal = 0, Solicita informal = 1/ Impedimento por tr√°mite=1) | H41: 0.2102*** | I41: 0.17587079999999999 | J41: 0.2446892
C42: (0.0166) | H42: (0.0175)
B43: errores est√°ndar robustos en par√©ntesis | G43: errores est√°ndar robustos en par√©ntesis
B44: *** p<0.01, ** p<0.05, * p<0.1 | G44: *** p<0.01, ** p<0.05, * p<0.1

Sheet: Capacidad predictiva
B4: p(y1=1) | H4: p(y2=1)
B5: solicita formal = 1 (D) | H5: Solicita informal = 1 (D)
C7: Valor verdadero | I7: Valor verdadero
B8: CLASIFICADO | C8: D | D8: -D | E8: TOTAL | H8: CLASIFICADO | I8: D | J8: -D | K8: TOTAL
B9: + | C9: 373 | D9: 540 | E9: =+SUM(RC[-2]:RC[-1]) -> 913 | H9: + | I9: 788 | J9: 242 | K9: =+SUM(RC[-2]:RC[-1]) -> 1030
B10: - | C10: 692 | D10: 4698 | E10: =+SUM(RC[-2]:RC[-1]) -> 5390 | H10: - | I10: 777 | J10: 4496 | K10: =+SUM(RC[-2]:RC[-1]) -> 5273
B11: TOTAL | C11: =+R[-1]C+R[-2]C -> 1065 | D11: =+R[-1]C+R[-2]C -> 5238 | E11: =+R[-1]C+R[-2]C -> 6303 | H11: TOTAL | I11: =+R[-1]C+R[-2]C -> 1565 | J11: =+R[-1]C+R[-2]C -> 4738 | K11: =+R[-1]C+R[-2]C -> 6303
B13: Porcentaje solicita formal = 1 | C13: =+R[-4]C/R[-2]C -> 0.35023474178403757 | H13: Porcentaje solicita informal = 1 | I13: =+R[-4]C/R[-2]C -> 0.50351437699680512
B14: Porcentaje solocita formal = 0 | C14: =+R[-4]C[1]/R[-3]C[1] -> 0.89690721649484539 | H14: Porcentaje solicita informal = 0 | I14: =+R[-4]C[1]/R[-3]C[1] -> 0.9489235964542001
B15: Clasificado correctamente | C15: =+(R[-6]C+R[-5]C[1])/R[-4]C[2] -> 0.8045375218150087 | H15: Clasificado correctamente | I15: =+(R[-6]C+R[-5]C[1])/R[-4]C[2] -> 0.83833095351419962
B17: Sensitividad | C17: =+R[-8]C/R[-6]C -> 0.35023474178403757 | H17: Sensitividad | I17: =+R[-8]C/R[-6]C -> 0.50351437699680512
B18: Especifidad | C18: =+R[-8]C[1]/R[-7]C[1] -> 0.89690721649484539 | H18: Especifidad | I18: =+R[-8]C[1]/R[-7]C[1] -> 0.9489235964542001
B19: Valor predictivo positivo | C19: =+R[-10]C/R[-10]C[2] -> 0.40854326396495072 | H19: Valor predictivo positivo | I19: =+R[-10]C/R[-10]C[2] -> 0.7650485436893204
B20: Valor predictivo negativo | C20: =+R[-10]C[1]/R[-10]C[2] -> 0.87161410018552876 | H20: Valor predictivo negativo | I20: =+R[-10]C[1]/R[-10]C[2] -> 0.85264555281623367
B22: Falsa tasa + para valor verdadero -D | C22: =+R[-13]C[1]/R[-11]C[1] -> 0.10309278350515463 | H22: Falsa tasa + para valor verdadero -D | I22: =+R[-13]C[1]/R[-11]C[1] -> 5.1076403545799919E-2
B23: Falsa tasa - para valor verdadero D | C23: =+R[-13]C/R[-12]C -> 0.64976525821596243 | H23: Falsa tasa - para valor verdadero D | I23: =+R[-13]C/R[-12]C -> 0.49648562300319488
B24: Falsa tasa + para clasificar como + | C24: =+R[-15]C[1]/R[-15]C[2] -> 0.59145673603504934 | H24: Falsa tasa + para clasificar como + | I24: =+R[-15]C[1]/R[-15]C[2] -> 0.23495145631067962
B25: Falsa tasa - para clasificar como - | C25: =+R[-15]C/R[-15]C[2] -> 0.12838589981447124 | H25: Falsa tasa - para clasificar como - | I25: =+R[-15]C/R[-15]C[2] -> 0.14735444718376636