Sheet: Nescesitar_crédito
B1: P(y2=1)
B2: Efectos Marginales de la probabilidad de necesitar crédito | C2: [ Intervalo de confianza 95% ]
A3: VARIABLES
A5: Estado civil | B5: -0.0191 | C5: -6.0759800000000003E-2 | D5: 2.26371E-2
B6: (0.0213)
A7: Lengua | B7: 0.0929*** | C7: 2.81111E-2 | D7: 0.1576504
B8: (0.0330)
A9: Edad | B9: 0.0136*** | C9: 6.4672999999999996E-3 | D9: 2.0807200000000001E-2
B10: (0.00366)
A11: Edad^2 | B11: -0.000166*** | C11: -2.4630000000000002E-4 | D11: -8.6100000000000006E-5
B12: (4.09e-05)
A13: Educcación (2) | B13: -0.0383 | C13: -8.5752999999999996E-2 | D13: 9.0553000000000005E-3
B14: (0.0242)
A15: Educación (3) | B15: -0.129*** | C15: -0.1849355 | D15: -7.2199700000000006E-2
B16: (0.0288)
A17: Mujer | B17: -0.00292 | C17: -5.4482500000000003E-2 | D17: 4.86404E-2
B18: (0.0263)
A19: Ingresos (1) | B19: -0.00501 | C19: -8.8288500000000006E-2 | D19: 7.8268500000000005E-2
B20: (0.0425)
A21: Ingresos(2) | B21: -0.0228 | C21: -0.1075749 | D21: 6.2051299999999997E-2
B22: (0.0433)
A23: Ingresos(3) | B23: 0.0234 | C23: -6.3603699999999999E-2 | D23: 0.1105
B24: (0.0444)
A25: Ingresos(4) | B25: -0.0313 | C25: -0.13467560000000001 | D25: 7.2039599999999995E-2
B26: (0.0527)
A27: Activos usados | B27: 0.0262 | C27: -1.53969E-2 | D27: 6.7774200000000007E-2
B28: (0.0212)
A29: Jefe del hogar | B29: -0.0216 | C29: -6.4661200000000002E-2 | D29: 2.1367000000000001E-2
B30: (0.0219)
A31: Empleo | B31: 0.101*** | C31: 3.2696799999999998E-2 | D31: 0.16852919999999999
B32: (0.0347)
A33: Estrato(1) | B33: 0.183*** | C33: 0.1216328 | D33: 0.24504190000000001
B34: (0.0315)
A35: Estrato(2) | B35: 0.140*** | C35: 7.4589699999999995E-2 | D35: 0.20493040000000001
B36: (0.0333)
A37: Estrato(3) | B37: 0.0963** | C37: 2.0334999999999999E-2 | D37: 0.172296
B38: (0.0388)
A39: Experiencia adversa | B39: 0.0308** | C39: 5.9391000000000001E-3 | D39: 5.5635499999999997E-2
B40: (0.0127)
A41: Ahorro | B41: 0.123*** | C41: 7.2323999999999999E-2 | D41: 0.17458000000000001
B42: (0.0261)
A43: Plan financiera | B43: -0.0514** | C43: -9.0880900000000001E-2 | D43: -1.19138E-2
B44: (0.0201)
A46: Observaciones | B46: 5,898
A47: errores estándar robustos en paréntesis
A48: *** p<0.01, ** p<0.05, * p<0.1

Sheet: Solicita_credito_formal
B1: P(Y1=1,Y2=1)
A2: VARIABLES | B2: Efectos Marginales de la probabilidad de solicitar crédito formal | C2: [ Intervalo de confianza 95% ]
A4: Presencia sistema financiero | B4: -0.0253 | C4: -0.100178 | D4: 4.9589000000000001E-2
B5: (0.0382)
A6: Tiempo en oficina | B6: -0.000964** | C6: -1.8760999999999999E-3 | D6: -5.27E-5
B7: (0.000465)
A8: Estado civil | B8: 0.0473 | C8: -1.3099100000000001E-2 | D8: 0.1077878
B9: (0.0308)
A10: Lengua | B10: -0.0266 | C10: -0.1085607 | D10: 5.5359100000000001E-2
B11: (0.0418)
A12: Edad | B12: 0.0130** | C12: 1.1555999999999999E-3 | D12: 2.4786200000000001E-2
B13: (0.00603)
A14: Edad^2 | B14: -0.000113 | C14: -2.5250000000000001E-4 | D14: 2.6100000000000001E-5
B15: (7.11e-05)
A16: Educcación (1) | B16: 0.0495 | C16: -2.2143900000000001E-2 | D16: 0.1211911
B17: (0.0366)
A18: Educación (2) | B18: 0.108** | C18: 1.4408600000000001E-2 | D18: 0.20141390000000001
B19: (0.0477)
A20: Mujer | B20: 0.0126 | C20: -4.0596500000000001E-2 | D20: 6.5722600000000006E-2
B21: (0.0271)
A22: Empleo dependiente | B22: -0.0922*** | C22: -0.1411753 | D22: -4.31695E-2
B23: (0.0250)
A24: Ingresos (1) | B24: 0.0642* | C24: -9.1502000000000007E-3 | D24: 0.1376465
B25: (0.0374)
A26: Ingresos(2) | B26: 0.0743** | C26: 1.016E-4 | D26: 0.14849870000000001
B27: (0.0379)
A28: Ingresos(3) | B28: 0.0478 | C28: -3.1841800000000003E-2 | D28: 0.12747030000000001
B29: (0.0406)
A30: Ingresos(4) | B30: 0.155*** | C30: 6.1833899999999997E-2 | D30: 0.24812500000000001
B31: (0.0475)
A32: Usa activos | B32: 0.0619** | C32: 4.7014999999999999E-3 | D32: 0.1190819
B33: (0.0292)
A34: Productos financieros | B34: 0.154*** | C34: 0.1046652 | D34: 0.20409849999999999
B35: (0.0254)
A36: Costo de impedimento | B36: 0.0444** | C36: 3.2195000000000001E-3 | D36: 8.5535799999999995E-2
B37: (0.0210)
A38: Impedimento por trámite | B38: 0.0900*** | C38: 4.8461400000000002E-2 | D38: 0.13158310000000001
B39: (0.0212)
A40: Credito consumo | B40: 0.203*** | C40: 0.1558725 | D40: 0.24974460000000001
B41: (0.0239)
A42: Crpedito colateral | B42: 0.418*** | C42: 0.33161109999999999 | D42: 0.50426629999999995
B43: (0.0440)
A44: Calculo de intereses | B44: 0.0520** | C44: 1.507E-4 | D44: 0.10378229999999999
B45: (0.0264)
A47: Obervaciones | B47: 5,769
A48: errores estándar robustos en paréntesis
A49: *** p<0.01, ** p<0.05, * p<0.1

Sheet: Probabilidades
C4: (1) | H4: (1)
B5: VARIABLES | C5: Probabilidades estimadas | D5: [ Intervalo de confianza 95% ] | G5: VARIABLES | H5: Probabilidades estimadas | I5: [ Intervalo de confianza 95% ]
B7: P( solicita formal = 1) | C7: 0.3393*** | D7: 0.2190619 | E7: 0.45972730000000001 | G7: P( nesecita crédito = 1) | H7: 0.6430*** | I7: 0.6201236 | J7: 0.66593040000000003
C8: (0.0613) | H8: (0.0116)
B9: P( solicita formal = 1/ mujer = 1) | C9: 0.3457*** | D9: 0.22620000000000001 | E9: 0.46510000000000001 | G9: P( necesita crédito = 1/ ingresos(1) = 1) | H9: 0.6495*** | I9: 0.60157970000000005 | J9: 0.69761629999999997
C10: (0.0609) | H10: (0.0244)
B11: P( solicita formal = 1 / crédito consumo = 1) | C11: 0.5105*** | D11: 0.40991759999999999 | E11: 0.61115960000000003 | G11: P( necesita crédito = 1 / ingresos(2) = 1) | H11: 0.6318*** | I11: 0.5818989 | J11: 0.68179350000000005
C12: (0.0513) | H12: (0.0254)
B13: P( solicita formal = 1 / crédito colateral = 1) | C13: 0.7487*** | D13: 0.65975280000000003 | E13: 0.83784170000000002 | G13: P( necesita crédito = 1 / ingresos(3) = 1) | H13: 0.6780*** | I13: 0.6344535 | J13: 0.72165880000000004
C14: (0.0454) | H14: (0.0222)
B15: P( solicita formal = 1 / empleo dependiente= 1) | C15: 0.2768*** | D15: 0.15617780000000001 | E15: 0.39753149999999998 | G15: P( necesita crédito = 1 / ingresos(4) = 1) | H15: 0.6232*** | I15: 0.56063540000000001 | J15: 0.68594469999999996
C16: (0.0615) | H16: (0.0319)
B17: P( solicita formal = 1 / producto financiero= 1) | C17: 0.4443*** | D17: 0.33396150000000002 | E17: 0.5547725 | G17: errores estándar robustos en paréntesis
C18: (0.0563) | G18: *** p<0.01, ** p<0.05, * p<0.1
B19: errores estándar robustos en paréntesis
B20: *** p<0.01, ** p<0.05, * p<0.1
C23: (1) | H23: (1)
B24: VARIABLES | C24: Probabilidades estimadas | D24: [ Intervalo de confianza 95% ] | G24: VARIABLES | H24: Probabilidades estimadas | I24: [ Intervalo de confianza 95% ]
G25: P( necesita crédito = 1/ educación(1) = 1) | H25: 0.7123*** | I25: 0.67201909999999998 | J25: 0.75259529999999997
B26: P( solicita formal = 1/ ingresos(1) = 1) | C26: 0.3484*** | D26: 0.22915949999999999 | E26: 0.46768130000000002 | H26: (0.0205)
C27: (0.0608) | G27: P( necesita crédito = 1 / educación(2) = 1) | H27: 0.6739*** | I27: 0.64139250000000003 | J27: 0.70652420000000005
B28: P( solicita formal = 1/ ingresos(2) = 1) | C28: 0.3584*** | D28: 0.23745820000000001 | E28: 0.47948659999999999 | H28: (0.0166)
C29: (0.0617) | G29: P( necesita crédito = 1 / educación(3) = 1) | H29: 0.5837*** | I29: 0.54539680000000001 | J29: 0.62208240000000004
B30: P( solicita formal = 1/ ingresos(3) = 1) | C30: 0.3319*** | D30: 0.21716489999999999 | E30: 0.44680819999999999 | H30: (0.0195)
C31: (0.0585) | G31: errores estándar robustos en paréntesis
B32: P( solicita formal = 1/ ingresos(4) = 1) | C32: 0.4391*** | D32: 0.30063299999999998 | E32: 0.57767040000000003 | G32: *** p<0.01, ** p<0.05, * p<0.1
C33: (0.0706)
B34: errores estándar robustos en paréntesis
B35: *** p<0.01, ** p<0.05, * p<0.1
C37: (1)
B38: VARIABLES | C38: Probabilidades estimadas | D38: [ Intervalo de confianza 95% ]
B40: P( solicita formal = 1/ educación(1) = 1) | C40: 0.2807*** | D40: 0.185034 | E40: 0.37641400000000003
C41: (0.0488)
B42: P( solicita formal = 1/ educación(2) = 1) | C42: 0.3302*** | D42: 0.2063807 | E42: 0.45411459999999998
C43: (0.0631)
B44: P( solicita formal = 1/ educación(3) = 1) | C44: 0.3886*** | D44: 0.2413449 | E44: 0.53592569999999995
C45: (0.0751)
B46: errores estándar robustos en paréntesis
B47: *** p<0.01, ** p<0.05, * p<0.1
B49: PROBABILIDADES ADICIONALES
C51: (1)
B52: VARIABLES | C52: Probabilidades estimadas | D52: [ Intervalo de confianza 95% ]
B54: P( solicita formal = 1/ necesita crédito = 1) | C54: 0.1948*** | D54: 0.17808550000000001 | E54: 0.21157719999999999
C55: (0.0085)
B56: P( solicita formal = 1, necesita crédito = 1) | C56: 0.1332*** | D56: 0.1215 | E56: 0.14480000000000001
C57: (0.0059)
B58: P( solicita formal = 0, necesita crédito = 1) | C58: 0.5085*** | D58: 0.48589500000000002 | E58: 0.53127769999999996
C59: (0.0115)
B60: P( solicita formal = 1, necesita crédito = 0) | C60: 0.2253*** | D60: 0.1337709 | E60: 0.31688050000000001
C61: (0.0467)
B62: errores estándar robustos en paréntesis
B63: *** p<0.01, ** p<0.05, * p<0.1

Sheet: Capacidad predictiva 1
B2: p(y2=1) | H2: p(y1=1, y2=1)
B3: Necesita crédito = 1 (D) | H3: Solicita crédito formal y necesita crédito = 1 (D)
C5: Valor verdadero | I5: Valor verdadero
B6: CLASIFICADO | C6: D | D6: -D | E6: TOTAL | H6: CLASIFICADO | I6: D | J6: -D | K6: TOTAL
B7: + | C7: 3955 | D7: 340 | E7: =+SUM(RC[-2]:RC[-1]) -> 4295 | H7: + | I7: 179 | J7: 734 | K7: =+SUM(RC[-2]:RC[-1]) -> 913
B8: - | C8: 1607 | D8: 401 | E8: =+SUM(RC[-2]:RC[-1]) -> 2008 | H8: - | I8: 565 | J8: 4825 | K8: =+SUM(RC[-2]:RC[-1]) -> 5390
B9: TOTAL | C9: =+R[-1]C+R[-2]C -> 5562 | D9: =+R[-1]C+R[-2]C -> 741 | E9: =+R[-1]C+R[-2]C -> 6303 | H9: TOTAL | I9: =+R[-1]C+R[-2]C -> 744 | J9: =+R[-1]C+R[-2]C -> 5559 | K9: =+R[-1]C+R[-2]C -> 6303
B11: Porcentaje necesita crédito = 1 | C11: =+R[-4]C/R[-2]C -> 0.7110751528227256 | H11: Porcentaje crédito formal y necesita = 1 | I11: =+R[-4]C/R[-2]C -> 0.24059139784946237
B12: Porcentaje necesita crédito = 0 | C12: =+R[-4]C[1]/R[-3]C[1] -> 0.54116059379217274 | H12: Porcentaje crédito formal y necesita = 0 | I12: =+R[-4]C[1]/R[-3]C[1] -> 0.86796186364454042
B13: Clasificado correctamente | C13: =+(R[-6]C+R[-5]C[1])/R[-4]C[2] -> 0.69109947643979053 | H13: Clasificado correctamente | I13: =+(R[-6]C+R[-5]C[1])/R[-4]C[2] -> 0.79390766301761062
B15: Sensitividad | C15: =+R[-8]C/R[-6]C -> 0.7110751528227256 | H15: Sensitividad | I15: =+R[-8]C/R[-6]C -> 0.24059139784946237
B16: Especifidad | C16: =+R[-8]C[1]/R[-7]C[1] -> 0.54116059379217274 | H16: Especifidad | I16: =+R[-8]C[1]/R[-7]C[1] -> 0.86796186364454042
B17: Valor predictivo positivo | C17: =+R[-10]C/R[-10]C[2] -> 0.92083818393480787 | H17: Valor predictivo positivo | I17: =+R[-10]C/R[-10]C[2] -> 0.19605695509309967
B18: Valor predictivo negativo | C18: =+R[-10]C[1]/R[-10]C[2] -> 0.1997011952191235 | H18: Valor predictivo negativo | I18: =+R[-10]C[1]/R[-10]C[2] -> 0.89517625231910947
B20: Falsa tasa + para valor verdadero -D | C20: =+R[-13]C[1]/R[-11]C[1] -> 0.45883940620782726 | H20: Falsa tasa + para valor verdadero -D | I20: =+R[-13]C[1]/R[-11]C[1] -> 0.13203813635545961
B21: Falsa tasa - para valor verdadero D | C21: =+R[-13]C/R[-12]C -> 0.28892484717727435 | H21: Falsa tasa - para valor verdadero D | I21: =+R[-13]C/R[-12]C -> 0.75940860215053763
B22: Falsa tasa + para clasificar como + | C22: =+R[-15]C[1]/R[-15]C[2] -> 7.9161816065192084E-2 | H22: Falsa tasa + para clasificar como + | I22: =+R[-15]C[1]/R[-15]C[2] -> 0.80394304490690038
B23: Falsa tasa - para clasificar como - | C23: =+R[-15]C/R[-15]C[2] -> 0.80029880478087645 | H23: Falsa tasa - para clasificar como - | I23: =+R[-15]C/R[-15]C[2] -> 0.10482374768089053

Sheet: Solicita crédito informal
A2: VARIABLES | B2: Efectos marginales de la probabilidad de solicitar crédito informal | C2: [ Intervalo de confianza 95% ]
A4: Presencia sistema financiero | B4: 0.0709** | C4: 8.3376000000000006E-3 | D4: 0.13351840000000001
B5: (0.0319)
A6: Tiempo oficina | B6: 0.000103** | C6: 1.2E-5 | D6: 1.9379999999999999E-4
B7: (4.64e-05)
A8: Estado civil | B8: 0.0452* | C8: -6.9766000000000003E-3 | D8: 9.7454100000000002E-2
B9: (0.0266)
A10: Lengua | B10: -0.0327 | C10: -0.10902779999999999 | D10: 4.36695E-2
B11: (0.0390)
A12: Edad | B12: -0.00233 | C12: -1.2720199999999999E-2 | D12: 8.0671000000000007E-3
B13: (0.00530)
A14: Edad^2 | B14: 7.75e-06 | C14: -1.164E-4 | D14: 1.3190000000000001E-4
B15: (6.33e-05)
A16: Educación(2) | B16: 0.0290 | C16: -4.6005299999999999E-2 | D16: 0.10404339999999999
B17: (0.0383)
A18: Educación(3) | B18: 0.0527 | C18: -3.9373999999999999E-2 | D18: 0.14474129999999999
B19: (0.0470)
A20: Mujer | B20: -0.0405 | C20: -9.2677899999999994E-2 | D20: 1.16411E-2
B21: (0.0266)
A22: Empleo dependiente | B22: -0.113*** | C22: -0.169126 | D22: -5.7066499999999999E-2
B23: (0.0286)
A24: Ingresos (1) | B24: 0.000816 | C24: -6.3982899999999995E-2 | D24: 6.5614400000000003E-2
B25: (0.0331)
A26: Ingresos (2) | B26: 0.0785** | C26: 3.5685000000000001E-3 | D26: 0.15337990000000001
B27: (0.0382)
A28: Ingresos (3) | B28: 0.0595 | C28: -1.5628599999999999E-2 | D28: 0.13471720000000001
B29: (0.0384)
A30: Ingresos (4) | B30: -0.00467 | C30: -0.10219739999999999 | D30: 9.2854400000000004E-2
B31: (0.0498)
A32: Usa activos | B32: -0.0284 | C32: -7.8540899999999997E-2 | D32: 2.1655899999999999E-2
B33: (0.0256)
A34: Productos financieros | B34: -0.0310 | C34: -9.48547E-2 | D34: 3.2943E-2
B35: (0.0326)
A36: Costo por impedimentos | B36: 0.00381 | C36: -3.8744000000000001E-2 | D36: 4.6365799999999999E-2
B37: (0.0217)
A38: Impedimentos por trámite | B38: -0.0148 | C38: -5.6328099999999999E-2 | D38: 2.6798499999999999E-2
B39: (0.0212)
A40: Crédito consumo | B40: 0.568*** | C40: 0.48556719999999998 | D40: 0.65095460000000005
B41: (0.0422)
A42: Crédito colateral | B42: 0.235*** | C42: 0.15716189999999999 | D42: 0.31310189999999999
B43: (0.0398)
A44: Cálculo de intereses | B44: -0.000425 | C44: -5.9448599999999997E-2 | D44: 5.8598999999999998E-2
B45: (0.0301)
A47: Obervaciones | B47: 5,769
A48: errores estándar robustos en paréntesis
A49: *** p<0.01, ** p<0.05, * p<0.1

Sheet: Probabilidades 2
C4: (1)
B5: VARIABLES | C5: Probabilidades estimadas | D5: [ Intervalo de confianza 95% ]
B7: P( solicita informal = 1) | C7: 0.4102*** | D7: 0.32740000000000002 | E7: 0.49299999999999999
C8: (0.0422)
B9: P( solicita informal = 1/ mujer = 1) | C9: 0.39*** | D9: 0.30309999999999998 | E9: 0.47699999999999998
C10: (0.0443)
B11: P( solicita informal = 1 / crédito consumo = 1) | C11: 0.8252*** | D11: 0.79730000000000001 | E11: 0.85309999999999997
C12: (0.0142)
B13: P( solicita informal = 1 / crédito colateral = 1) | C13: 0.6360*** | D13: 0.55700000000000005 | E13: 0.71499999999999997
C14: (0.0403)
B15: P( solicita informal = 1 / empleo dependiente= 1) | C15: 0.3326*** | D15: 0.2402 | E15: 0.4249
C16: (0.0471)
B17: P( solicita informal = 1 / producto financiero= 1) | C17: 0.3902*** | D17: 0.29210000000000003 | E17: 0.48830000000000001
C18: (0.0500)
B19: errores estándar robustos en paréntesis
B20: *** p<0.01, ** p<0.05, * p<0.1
B22: PROBABILIDADES ADICIONALES
C24: (1)
B25: VARIABLES | C25: Probabilidades estimadas | D25: [ Intervalo de confianza 95% ]
B27: P( solicita informal = 1/ necesita crédito = 1) | C27: 0.2092*** | D27: 0.19270419999999999 | E27: 0.22586729999999999
C28: (0.0084)
B29: P( solicita informal = 1, necesita crédito = 1) | C29: 0.1462*** | D29: 0.13304270000000001 | E29: 0.1593839
C30: (0.0067)
B31: P( solicita informal = 0, necesita crédito = 1) | C31: 0.4975*** | D31: 0.47576190000000002 | E31: 0.51937449999999996
C32: (0.0111)
B33: P( solicita informal = 1, necesita crédito = 0) | C33: 0.2620*** | D33: 0.19400000000000001 | E33: 0.33
C34: (0.0346)
B35: errores estándar robustos en paréntesis
B36: *** p<0.01, ** p<0.05, * p<0.1

Sheet: Capacidad predicitva 2
C4: p(y1=1, y2=1)
C5: Solicita crédito informal y necesita crédito = 1 (D)
D7: Valor verdadero
C8: CLASIFICADO | D8: D | E8: -D | F8: TOTAL
C9: + | D9: 451 | E9: 579 | F9: =+SUM(RC[-2]:RC[-1]) -> 1030
C10: - | D10: 636 | E10: 4637 | F10: =+SUM(RC[-2]:RC[-1]) -> 5273
C11: TOTAL | D11: =+R[-1]C+R[-2]C -> 1087 | E11: =+R[-1]C+R[-2]C -> 5216 | F11: =+R[-1]C+R[-2]C -> 6303
C13: Porcentaje crédito informal y necesita = 1 | D13: =+R[-4]C/R[-2]C -> 0.41490340386384544
C14: Porcentaje crédito informal y necesita = 0 | D14: =+R[-4]C[1]/R[-3]C[1] -> 0.88899539877300615
C15: Clasificado correctamente | D15: =+(R[-6]C+R[-5]C[1])/R[-4]C[2] -> 0.80723465016658735
C17: Sensitividad | D17: =+R[-8]C/R[-6]C -> 0.41490340386384544
C18: Especifidad | D18: =+R[-8]C[1]/R[-7]C[1] -> 0.88899539877300615
C19: Valor predictivo positivo | D19: =+R[-10]C/R[-10]C[2] -> 0.43786407766990293
C20: Valor predictivo negativo | D20: =+R[-10]C[1]/R[-10]C[2] -> 0.87938554902332633
C22: Falsa tasa + para valor verdadero -D | D22: =+R[-13]C[1]/R[-11]C[1] -> 0.11100460122699386
C23: Falsa tasa - para valor verdadero D | D23: =+R[-13]C/R[-12]C -> 0.5850965961361545
C24: Falsa tasa + para clasificar como + | D24: =+R[-15]C[1]/R[-15]C[2] -> 0.56213592233009713
C25: Falsa tasa - para clasificar como - | D25: =+R[-15]C/R[-15]C[2] -> 0.12061445097667362